{
  "renderer_environment_id": "RENV-PHASE4B-001",
  "renderer_id": "PLAYWRIGHT_HTML_CSS",
  "renderer_version": "1.0.0",
  "node_version": "v24.19.0",
  "platform": "darwin",
  "architecture": "arm64",
  "playwright_version": "1.62.1",
  "chromium_version": "Chromium 145.0.7632.6",
  "headless_mode": "HEADLESS",
  "viewport": {
    "width": 1242,
    "height": 1660
  },
  "device_scale_factor": 1,
  "locale": "zh-CN",
  "timezone": "Asia/Shanghai",
  "color_scheme": "light",
  "reduced_motion": "reduce",
  "screenshot_options": {
    "type": "png",
    "animations": "disabled",
    "caret": "hide",
    "scale": "css",
    "omit_background": false
  },
  "resolved_fonts": [
    {
      "role": "TITLE",
      "family": "PingFang SC"
    },
    {
      "role": "BODY",
      "family": "PingFang SC"
    }
  ],
  "font_profile_hash": "bbbbbbbbbbbbbbbbbbbbbbbbbbbbbbbbbbbbbbbbbbbbbbbbbbbbbbbbbbbbbbbb",
  "network_requests_attempted": 0,
  "network_requests_blocked": 0,
  "environment_fingerprint": "cccccccccccccccccccccccccccccccccccccccccccccccccccccccccccccccc",
  "created_at": "2099-01-01T01:02:03.000Z",
  "run_id": "RUN-20990101-010203-DEMO",
  "schema_version": "1.0.0",
  "extensions": {}
}
